{
  "schema": "sns.loop-run.v2",
  "run_id": "RUN-20260902T165909021808Z-monthly-governance-pr22-reconciliation-3a7c91d5e2b6f8041a20",
  "loop_id": "monthly-governance",
  "contract_version": "1.1.0",
  "trigger": "explicit-human",
  "trigger_time": "2026-09-02T16:59:09.021808Z",
  "source_commit": "7fb4a4167b5cde5af3aca05c34cfdd0a7b903ad7",
  "state_snapshot": {
    "schema": "sns.state-snapshot.v1",
    "source_commit": "7fb4a4167b5cde5af3aca05c34cfdd0a7b903ad7",
    "records": [
      {
        "role": "active_contract",
        "path": "automation/contracts/monthly-governance.v1.1.md",
        "git_blob_sha": "cf2b4af96f67909e0a1c3555b5b1c5c6ab13fd25"
      },
      {
        "role": "active_quest_index",
        "path": "quests/active/README.md",
        "git_blob_sha": "fc73126967f48d4429a36f9c78e6fd8863a6f100"
      },
      {
        "role": "canonical_memory",
        "path": "memory/mem_log_short.md",
        "git_blob_sha": "52ef15cdfcb51c7055207d9b70175b0cdfa92587"
      },
      {
        "role": "research_graph",
        "path": "quests/research_graph.json",
        "git_blob_sha": "ab0b0a380a735cde3b365341ea70e73e7864ec83"
      },
      {
        "role": "runtime_manifest",
        "path": "automation/runtime_manifest.json",
        "git_blob_sha": "56935c9d9a89b80a2b2a11aadc9b41522d42e3c2"
      },
      {
        "role": "stable_law",
        "path": "AGENTS.md",
        "git_blob_sha": "e96689268600d88db95a8022342b5f0526041382"
      },
      {
        "role": "state_ownership",
        "path": "automation/state_ownership.json",
        "git_blob_sha": "6d17c3253cf336de2c62ef90133523295c984c36"
      }
    ],
    "open_prs": [
      {
        "number": 61,
        "head_sha": "61602ff9d8ecf9a92ec50d8931e778b264ec5945",
        "draft": false,
        "state": "open"
      }
    ],
    "fingerprint": "sha256:bc772fd960c6518f37fc22aff03111dc081406ed4b647df8d4ccd93884d46e86"
  },
  "receipt_kind": "run",
  "quest_context": {
    "authority_issue": 38,
    "transaction": 2,
    "decision_level": "L2",
    "scope": "Mechanically reconcile PR #22 lifecycle state from stale draft_active to verified merged; preserve all scientific and queue state.",
    "explicit_authority": "Current human instruction authorizes completion of Issue #38."
  },
  "pr_context": {
    "pr_number": 22,
    "live_state": "closed/merged",
    "head_commit": "25e7627e4cea9a3b1509df696e38f18046e9a5ca",
    "merge_commit": "d98ee2a15dd74e0211a1ab5ef07dc60928736061",
    "lifecycle_path": "automation/pr_lifecycle/22.json"
  },
  "consumed_ids": [],
  "artifacts": [
    "automation/pr_lifecycle/22.json"
  ],
  "checks": [
    {
      "name": "GitHub connector preflight",
      "status": "passed",
      "evidence": "Live repository ref and PR #22 reads succeeded at source main 7fb4a4167b5cde5af3aca05c34cfdd0a7b903ad7."
    },
    {
      "name": "PR #22 merge identity",
      "status": "passed",
      "evidence": "GitHub reports PR #22 closed, merged, head 25e7627e4cea9a3b1509df696e38f18046e9a5ca, and merge commit d98ee2a15dd74e0211a1ab5ef07dc60928736061."
    },
    {
      "name": "lifecycle-only boundary",
      "status": "passed",
      "evidence": "The transaction changes only automation/pr_lifecycle/22.json; no quest, queue, belief, memory, delegation, scheduler, or scientific implementation surface is included."
    },
    {
      "name": "receipt-bearing hosted validation",
      "status": "not_run",
      "evidence": "The exact receipt-bearing head must execute tests, baseline-artifacts, automation-transaction, and semantic repository validation before acceptance."
    }
  ],
  "belief_effects": [],
  "terminal_state": "DONE_WITH_LIMITATIONS",
  "next_action": "Qualify the receipt-bearing lifecycle reconciliation head; if exact-head checks pass, merge and re-read canonical main.",
  "created_at": "2026-09-02T16:59:09.021808Z"
}
