{
  "run_id": "RUN-20261001T194242457414Z-system-audit-f7e000e21fc622e8cd0e",
  "loop_id": "system-audit",
  "contract_version": "1.0.0",
  "trigger": "explicit-human",
  "trigger_time": "2026-10-01T19:37:09Z",
  "created_at": "2026-10-01T19:42:42.457414+00:00",
  "source_commit": "04fc952f2047c875dedcc5dd527cedfb9f51de68",
  "quest_context": {
    "authority": "Explicit human approval to renew bounded October authority, execute the existing META route, retain SYNTH R2 pause; separate approval for fixture-only September binding. Not a standing Monthly action under expired September authority.",
    "fixture_boundary": "Fixture setup only; assertions, validators, schemas and immutable historical records unchanged."
  },
  "pr_context": {
    "branch": "october/2026-renewal"
  },
  "consumed_ids": [],
  "artifacts": [
    "automation/standing/2026-10.v1.json",
    "automation/standing/current.json",
    "calendar/monthly/2026-10.md",
    "quests/dispositions/2026-10-01.json",
    "quests/active/README.md",
    "memory/mem_log_short.md",
    "tests/test_automation_standing_authority.py"
  ],
  "checks": [
    {
      "name": "python -m pytest -q",
      "status": "passed",
      "evidence": "233 passed after fixture-only repair."
    },
    {
      "name": "python -m automation.cli validate-repository",
      "status": "passed",
      "evidence": "valid true; no errors."
    },
    {
      "name": "baseline-artifacts",
      "status": "passed",
      "evidence": "Isolated 50-step baseline artifact check passed; tracked scientific outputs unchanged."
    },
    {
      "name": "hosted qualification and accepted-main backstop",
      "status": "not_run",
      "evidence": "Pending publication; exact-head hosted logs and main push backstop required before claiming acceptance."
    }
  ],
  "belief_effects": [],
  "terminal_state": "DONE_WITH_LIMITATIONS",
  "next_action": "Qualify and expected-head merge the human-owned renewal; refresh accepted source before the separate Weekly META slice. No scheduler changes or SYNTH R2 execution.",
  "decision_effect": "Human acceptance authorizes bounded renewal; historical September fixtures remain temporally bound rather than inheriting the live pointer. Scientific state unchanged.",
  "observability": {
    "administrative_transactions": 1,
    "scientific_artifacts": 0,
    "continuity": "independent"
  },
  "schema": "sns.loop-run.v2",
  "state_snapshot": {
    "schema": "sns.state-snapshot.v1",
    "source_commit": "04fc952f2047c875dedcc5dd527cedfb9f51de68",
    "records": [
      {
        "role": "active_contract",
        "path": "automation/contracts/system-audit.v1.md",
        "git_blob_sha": "b0884f997e5108fdbefd5a1ae9c634b466068e8f"
      },
      {
        "role": "active_quest_index",
        "path": "quests/active/README.md",
        "git_blob_sha": "bca97bb56afbcd73f2cde065ca1da96c12370a9a"
      },
      {
        "role": "canonical_memory",
        "path": "memory/mem_log_short.md",
        "git_blob_sha": "747ef6c7046c7a3cb9e539b80d13c0fd8811820c"
      },
      {
        "role": "monthly_state",
        "path": "calendar/monthly/2026-09.md",
        "git_blob_sha": "7c283b1f9678e4f59b08c9660729cf672cda0aee"
      },
      {
        "role": "research_graph",
        "path": "quests/research_graph.json",
        "git_blob_sha": "114185b3ef8690ea70841c85435142e8953b9532"
      },
      {
        "role": "runtime_manifest",
        "path": "automation/runtime_manifest.json",
        "git_blob_sha": "4aadb547e3637fda22b1d7cb79a99b69a70f5896"
      },
      {
        "role": "stable_law",
        "path": "AGENTS.md",
        "git_blob_sha": "04ea1228cbd39248aa2be36a223a936047801894"
      },
      {
        "role": "standing_authority",
        "path": "automation/standing/2026-09.v1.json",
        "git_blob_sha": "e0d774e3334debf514446f89196e79bd7f71eaed"
      },
      {
        "role": "standing_pointer",
        "path": "automation/standing/current.json",
        "git_blob_sha": "9d806867b3dbac0f1b11ab9d45819fc097002d30"
      },
      {
        "role": "state_ownership",
        "path": "automation/state_ownership.json",
        "git_blob_sha": "a3de0e50d4474bc1283d0458c1fc7489c52c5db6"
      }
    ],
    "open_prs": [],
    "fingerprint": "sha256:50312b3fd0e8d7d62963d309744fee706035b09a99ab2d7acd31471cf270ee19"
  },
  "receipt_kind": "run"
}
