{
  "schema": "sns.loop-run.v2",
  "run_id": "RUN-20260829T161812000000Z-daily-governance-triage-8e4b71c2d9a6053f102a",
  "loop_id": "daily-governance-triage",
  "contract_version": "1.1.0",
  "trigger": "scheduled",
  "trigger_time": "2026-08-29T16:18:12Z",
  "source_commit": "9fb924182ec1a772383229f3219b5aa55ec1d9c0",
  "state_snapshot": {
    "schema": "sns.state-snapshot.v1",
    "source_commit": "9fb924182ec1a772383229f3219b5aa55ec1d9c0",
    "records": [
      {"role": "active_contract", "path": "automation/contracts/daily-governance-triage.v1.1.md", "git_blob_sha": "c65f6310808f9f3c9bc5536be890a33283e1bf8c"},
      {"role": "active_quest_index", "path": "quests/active/README.md", "git_blob_sha": "fc73126967f48d4429a36f9c78e6fd8863a6f100"},
      {"role": "canonical_memory", "path": "memory/mem_log_short.md", "git_blob_sha": "52ef15cdfcb51c7055207d9b70175b0cdfa92587"},
      {"role": "current_delegation", "path": "automation/delegations/2026-08.json", "git_blob_sha": "ccc2cdcf54e1e258326731dda8722167d2c555ad"},
      {"role": "latest_daily_receipt", "path": "automation/runs/2026/08/RUN-20260829T134700000000Z-daily-research-operator-9c4e71a2b805d63f102a.json", "git_blob_sha": "871fdd6a14659f959d5bab1090e8ee9eb18685ab"},
      {"role": "latest_triage_receipt", "path": "automation/runs/2026/08/RUN-20260828T161754000000Z-daily-governance-triage-a1c7e94b2d805f63b210.json", "git_blob_sha": "6f203415d67f2f41a32277123fa7212e906f8174"},
      {"role": "monthly_state", "path": "calendar/monthly/2026-08.md", "git_blob_sha": "bc430e8428bcf9548bff4ed7a94647cefee1b9af"},
      {"role": "recent_pr_lifecycle", "path": "automation/pr_lifecycle/55.json", "git_blob_sha": "15a2e8e306c8d6b44404c35819690c46e8725ee7"},
      {"role": "research_graph", "path": "quests/research_graph.json", "git_blob_sha": "ab0b0a380a735cde3b365341ea70e73e7864ec83"},
      {"role": "runtime_manifest", "path": "automation/runtime_manifest.json", "git_blob_sha": "56935c9d9a89b80a2b2a11aadc9b41522d42e3c2"},
      {"role": "selected_quest", "path": "quests/active/QST-SIM-0003-geo-ring-power-chain.md", "git_blob_sha": "594775bdbc10e1c4c3f3514484eaa87415047ea1"},
      {"role": "stable_law", "path": "AGENTS.md", "git_blob_sha": "e96689268600d88db95a8022342b5f0526041382"},
      {"role": "state_ownership", "path": "automation/state_ownership.json", "git_blob_sha": "6d17c3253cf336de2c62ef90133523295c984c36"}
    ],
    "open_prs": [],
    "fingerprint": "sha256:5fb5b6684f684844dab4566889603fb881beeefbf40da3555906da586dac0c29"
  },
  "receipt_kind": "run",
  "quest_context": {
    "selected_quest_id": "QST-SIM-0003",
    "selected_level": "L1",
    "selected_blocker_scope": "local",
    "acceptance_slice": "Add one bounded deterministic receiver/line-of-sight window primitive to the existing GEORingWorld baseline, preserve legacy always-visible behavior by default, expose the resulting boolean through EnvironmentSample.line_of_sight_to_host, add focused synthetic tests, and emit at most one small deterministic phase-sweep output. This slice measures visibility only; it does not compare role mixes, storage fractions, relay efficiency, or architecture value.",
    "delegation_id": "DELEG-20260807-HUMAN-FAST-TRIAGE-V1",
    "routing": [
      {"quest_id": "QST-STOR-0002", "decision_level": "L2", "blocker_scope": "local", "disposition": "The accepted fast-rotator surface route remains falsified; selecting a replacement STOR architecture remains Monthly Governance work. Remove only this route from today's candidates and continue."},
      {"quest_id": "QST-ARCI-0001", "decision_level": "L2", "blocker_scope": "local", "disposition": "The bounded synthetic-target sensitivity slice selected by August Monthly Governance is already complete; extending into the recommended surface-operations measurement would exceed that accepted method without a fresh governance decision. Continue routing."},
      {"quest_id": "QST-SIM-0002", "decision_level": "L2", "blocker_scope": "local", "disposition": "Finite-time stale coverage and the two constant-rotation measurement are already accepted. The remaining method now requires irregular/shadow-model assumptions or policy comparison, so triage does not choose that scientific route. Continue routing."},
      {"quest_id": "QST-SIM-0003", "decision_level": "L1", "blocker_scope": "local", "disposition": "Graph-ready, active, delegated, owner-conflict-free, and bounded. The first remaining method item, receiver/line-of-sight windows, can be implemented as one reversible synthetic visibility primitive without selecting a relay architecture or weakening a falsifier. AUTHORIZATION issued."}
    ]
  },
  "pr_context": {
    "open_pull_requests_at_snapshot": [],
    "implementation_owner": null,
    "lifecycle_synchronizations": [],
    "governance_transaction_pr": 59,
    "note": "PR #55 is already merged and its lifecycle is synchronized; there is no scientific implementation owner to continue. PR #59 is this governance-only publication transaction, not an implementation owner."
  },
  "consumed_ids": ["DELEG-20260807-HUMAN-FAST-TRIAGE-V1"],
  "artifacts": [
    {"path": "automation/authorizations/2026/08/AUTH-20260829T161812000000Z-sim3-receiver-los-7d3a91c4b8e2056f1a2c.json", "kind": "bounded governance authorization"}
  ],
  "checks": [
    {"name": "GitHub connector preflight", "status": "passed", "evidence": "GitHub repository metadata read succeeded for xxx3r/SNS-S-S with push/admin access."},
    {"name": "active contract resolution", "status": "passed", "evidence": "Exactly one daily-governance-triage contract is active on accepted main: contract version 1.1.0."},
    {"name": "inspectable state snapshot", "status": "passed", "evidence": "sns.state-snapshot.v1 records exact Git blob identities for stable law, active contract, state ownership, active quest index, research graph, runtime manifest, canonical memory, August delegation, accepted Monthly state, latest Daily/triage lineage, merged PR #55 lifecycle, and the selected SIM3 quest; no open scientific PR ownership rows were observed."},
    {"name": "global provenance blocker disposition", "status": "passed", "evidence": "Research Organization v2 replaced the placeholder state_hash convention with sns.state-snapshot.v1, and the existing PR #55 lineage was corrected and merged on accepted main."},
    {"name": "source, delegation, graph readiness, ownership, and authorization uniqueness recheck", "status": "passed", "evidence": "Immediately before transaction publication, accepted main remained 9fb924182ec1a772383229f3219b5aa55ec1d9c0, the August delegation remained valid, the graph has no hard requires edge blocking QST-SIM-0003, no open scientific implementation owner existed, and repository search found no prior sim3-receiver-los authorization."},
    {"name": "repository-hosted transaction validation", "status": "passed", "evidence": "PR #59 preliminary transaction head e8059ca6a39f0c95427b1870f93598ae2ca951b1 passed tests run 33262785307, baseline-artifacts run 33262785308, and automation-transaction run 33262785311; the transaction job explicitly passed automation tests and semantic repository validation. This receipt-only evidence update remains merge-gated on a second exact-head replay of the same workflows."},
    {"name": "Google Drive dependency", "status": "not_run", "evidence": "Neither the active contract nor today's bounded routing decision requires a Drive artifact; no Drive read was needed."}
  ],
  "belief_effects": [],
  "terminal_state": "DONE",
  "next_action": "After PR #59's receipt-bearing head revalidates and merges, Daily Research Operator should consume AUTH-20260829T161812000000Z-sim3-receiver-los-7d3a91c4b8e2056f1a2c and implement only the bounded synthetic receiver/line-of-sight window slice for QST-SIM-0003.",
  "created_at": "2026-08-29T16:18:12Z"
}
