{
  "schema": "sns.loop-run.v2",
  "run_id": "RUN-20260902T170939821662Z-monthly-governance-pr23-supersession-4b8e2c6f1a7d9053e2c1",
  "loop_id": "monthly-governance",
  "contract_version": "1.1.0",
  "trigger": "explicit-human",
  "trigger_time": "2026-09-02T17:09:39.821662Z",
  "source_commit": "2fa201808549631d6683f1c77b5e4976d5421288",
  "state_snapshot": {
    "schema": "sns.state-snapshot.v1",
    "source_commit": "2fa201808549631d6683f1c77b5e4976d5421288",
    "records": [
      {
        "role": "active_contract",
        "path": "automation/contracts/monthly-governance.v1.1.md",
        "git_blob_sha": "cf2b4af96f67909e0a1c3555b5b1c5c6ab13fd25"
      },
      {
        "role": "active_quest_index",
        "path": "quests/active/README.md",
        "git_blob_sha": "fc73126967f48d4429a36f9c78e6fd8863a6f100"
      },
      {
        "role": "canonical_memory",
        "path": "memory/mem_log_short.md",
        "git_blob_sha": "52ef15cdfcb51c7055207d9b70175b0cdfa92587"
      },
      {
        "role": "research_graph",
        "path": "quests/research_graph.json",
        "git_blob_sha": "ab0b0a380a735cde3b365341ea70e73e7864ec83"
      },
      {
        "role": "runtime_manifest",
        "path": "automation/runtime_manifest.json",
        "git_blob_sha": "56935c9d9a89b80a2b2a11aadc9b41522d42e3c2"
      },
      {
        "role": "stable_law",
        "path": "AGENTS.md",
        "git_blob_sha": "e96689268600d88db95a8022342b5f0526041382"
      },
      {
        "role": "state_ownership",
        "path": "automation/state_ownership.json",
        "git_blob_sha": "6d17c3253cf336de2c62ef90133523295c984c36"
      }
    ],
    "open_prs": [
      {
        "number": 61,
        "head_sha": "61602ff9d8ecf9a92ec50d8931e778b264ec5945",
        "draft": false,
        "state": "open"
      }
    ],
    "fingerprint": "sha256:66d694e74270914779908f977cb7e23a5519a76aa8553977d40f85d910db3f42"
  },
  "receipt_kind": "run",
  "quest_context": {
    "authority_issue": 38,
    "transaction": 3,
    "decision_level": "L2",
    "scope": "Mechanically reconcile PR #23 lifecycle state from stale draft_active to verified superseded by accepted PR #34; preserve all scientific and queue state.",
    "explicit_authority": "Current human instruction authorizes completion of Issue #38."
  },
  "pr_context": {
    "pr_number": 23,
    "live_state": "closed/unmerged",
    "head_commit": "53b700aa35f647a1c37fffdc00ae784ab2771458",
    "replacement_pr_number": 34,
    "replacement_head_commit": "176832064a3cfc1ad583626ba0c6232da68086f0",
    "replacement_merge_commit": "29c9ae7baf44df05ffcfa830da893bc3aeeca9d9",
    "lifecycle_path": "automation/pr_lifecycle/23.json"
  },
  "consumed_ids": [],
  "artifacts": [
    "automation/pr_lifecycle/23.json"
  ],
  "checks": [
    {
      "name": "GitHub connector preflight",
      "status": "passed",
      "evidence": "Live repository ref, PR #23, PR #34, current open-PR ownership, and canonical snapshot records were read at source main 2fa201808549631d6683f1c77b5e4976d5421288."
    },
    {
      "name": "PR #23 closed-unmerged identity",
      "status": "passed",
      "evidence": "GitHub reports PR #23 closed, unmerged, draft, head 53b700aa35f647a1c37fffdc00ae784ab2771458, and base e8afc90f6c72d0a63f68ba7519f05b0f4bc77ea6."
    },
    {
      "name": "PR #34 recovery identity",
      "status": "passed",
      "evidence": "GitHub reports PR #34 merged at 29c9ae7baf44df05ffcfa830da893bc3aeeca9d9 from head 176832064a3cfc1ad583626ba0c6232da68086f0; its recovery comment identifies PR #23 as superseded."
    },
    {
      "name": "lifecycle-only boundary",
      "status": "passed",
      "evidence": "The transaction changes only automation/pr_lifecycle/23.json; no quest, queue, belief, memory, delegation, scheduler, or scientific implementation surface is included."
    },
    {
      "name": "receipt-bearing hosted validation",
      "status": "not_run",
      "evidence": "The exact receipt-bearing head must execute tests, baseline-artifacts, automation-transaction, and semantic repository validation before acceptance."
    }
  ],
  "belief_effects": [],
  "terminal_state": "DONE_WITH_LIMITATIONS",
  "next_action": "Qualify the receipt-bearing lifecycle reconciliation head; if exact-head checks pass, merge and re-read canonical main.",
  "created_at": "2026-09-02T17:09:39.821662Z"
}
