{
  "schema": "sns.loop-run.v2",
  "run_id": "RUN-20260902T190916629850Z-daily-governance-triage-september-arci-a1b2c3d4e5f60718293a",
  "loop_id": "daily-governance-triage",
  "contract_version": "1.1.0",
  "trigger": "explicit-human",
  "trigger_time": "2026-09-02T19:09:16.629850Z",
  "source_commit": "6785ffcb158841ad1a7f4614cf0a3af3de1af5b1",
  "state_snapshot": {
    "schema": "sns.state-snapshot.v1",
    "source_commit": "6785ffcb158841ad1a7f4614cf0a3af3de1af5b1",
    "records": [
      {
        "role": "active_contract",
        "path": "automation/contracts/daily-governance-triage.v1.1.md",
        "git_blob_sha": "c65f6310808f9f3c9bc5536be890a33283e1bf8c"
      },
      {
        "role": "active_quest_index",
        "path": "quests/active/README.md",
        "git_blob_sha": "fc73126967f48d4429a36f9c78e6fd8863a6f100"
      },
      {
        "role": "canonical_memory",
        "path": "memory/mem_log_short.md",
        "git_blob_sha": "618b24b4e799ad6fb7c44c3580b772e1ab38db6a"
      },
      {
        "role": "research_graph",
        "path": "quests/research_graph.json",
        "git_blob_sha": "ab0b0a380a735cde3b365341ea70e73e7864ec83"
      },
      {
        "role": "runtime_manifest",
        "path": "automation/runtime_manifest.json",
        "git_blob_sha": "56935c9d9a89b80a2b2a11aadc9b41522d42e3c2"
      },
      {
        "role": "stable_law",
        "path": "AGENTS.md",
        "git_blob_sha": "e96689268600d88db95a8022342b5f0526041382"
      },
      {
        "role": "state_ownership",
        "path": "automation/state_ownership.json",
        "git_blob_sha": "6d17c3253cf336de2c62ef90133523295c984c36"
      }
    ],
    "open_prs": [],
    "fingerprint": "sha256:a2e5b68510dc6285c3ff665f036f96cc8726559f0ee28f547821137f12bdb3fe"
  },
  "receipt_kind": "run",
  "inheritance": [
    {
      "kind": "RUN",
      "ref": "RUN-20260902T185807761521Z-monthly-governance-september-transition-c4d8e2a6f1b9073c5e2a",
      "decision_effect": "Inherited the accepted September Monthly transition and its constitutional disposition."
    },
    {
      "kind": "artifact",
      "ref": "automation/delegations/2026-09.json",
      "decision_effect": "Inherited the sole active September delegation envelope."
    },
    {
      "kind": "artifact",
      "ref": "calendar/monthly/2026-09.md",
      "decision_effect": "Inherited the accepted Monthly route: ARCI remains the current executable spawn and no scientific state changes."
    }
  ],
  "decision_effect": "Issued exactly one bounded QST-ARCI-0001 refine_existing authorization under the accepted September delegation; no scientific, quest, belief, memory, graph, or scheduler state was changed.",
  "observability": {
    "proposal_at": "2026-09-02T18:58:07.761521Z",
    "authorization_at": "2026-09-02T19:09:16.629850Z",
    "first_artifact_at": "2026-09-02T19:09:16.629850Z",
    "administrative_transactions": 1,
    "scientific_artifacts": 0,
    "continuity": "inherited"
  },
  "quest_context": {
    "authority_issue": 65,
    "decision_level": "L1",
    "scope": "One bounded September Pre-Game route for QST-ARCI-0001 under the accepted delegation.",
    "explicit_authority": "September Organization v2.x Monthly transition accepted at main 6785ffcb158841ad1a7f4614cf0a3af3de1af5b1 and explicitly authorized by Issue #65 comment 5514504198.",
    "delegation_id": "DELEG-20260902-HUMAN-SEPTEMBER-TRIAGE-V1",
    "route": "QST-ARCI-0001 is the current executable active quest; the STOR fast-rotator route remains a separate local falsifier and is not reopened.",
    "blocker_scope": "none_for_authorized_slice",
    "decision_effect": "Triage authorizes implementation only; it does not modify queue membership, priority, beliefs, memory, contracts, schemas, or scientific architecture."
  },
  "pr_context": {
    "live_open_prs": [],
    "implementation_owner": "none_at_triage_source_freeze",
    "disposition": "No open PR ownership conflict existed. Daily may open at most one implementation PR under this authorization."
  },
  "consumed_ids": [
    "RUN-20260902T185807761521Z-monthly-governance-september-transition-c4d8e2a6f1b9073c5e2a"
  ],
  "artifacts": [
    "automation/authorizations/2026/09/AUTH-20260902T190916629850Z-arci-september-refine-b1c2d3e4f5a60718293a.json",
    "automation/delegations/2026-09.json"
  ],
  "checks": [
    {
      "name": "GitHub source and delegation preflight",
      "status": "passed",
      "evidence": "Canonical main 6785ffcb158841ad1a7f4614cf0a3af3de1af5b1, the September delegation, active triage contract, canonical memory, and zero open main-targeting PRs were read before authorization."
    },
    {
      "name": "delegation validity",
      "status": "passed",
      "evidence": "The authorization targets QST-ARCI-0001 only, uses refine_existing only, stays inside configs/**, experiments/**, tests/**, and outputs/**, expires before the delegation, and keeps one PR/receipt limits."
    },
    {
      "name": "deterministic slot routing",
      "status": "passed",
      "evidence": "The active index and accepted Monthly memory identify QST-ARCI-0001 as the current executable spawn; the QST-STOR-0002 fast-rotator stop is local and does not reopen its architecture route."
    },
    {
      "name": "live ownership and acceptance boundary",
      "status": "passed",
      "evidence": "No open implementation PR or owner conflict exists at source freeze; the authorization is one bounded Daily slot and does not grant queue, belief, memory, contract, schema, architecture, or external/public authority."
    },
    {
      "name": "mandatory repository checks",
      "status": "not_run",
      "evidence": "The exact receipt-bearing Pre-Game head must execute automation tests and python -m automation.cli validate-repository in hosted qualification."
    },
    {
      "name": "scheduler sequencing",
      "status": "not_run",
      "evidence": "Pre-Game is enabled; Daily remains held until this accepted Pre-Game result is merged and re-read on canonical main."
    }
  ],
  "belief_effects": [],
  "terminal_state": "DONE_WITH_LIMITATIONS",
  "next_action": "Qualify and merge this exact Pre-Game authorization/receipt head; then enable Daily. Daily may consume this authorization only once and must stop at the declared scientific, ownership, or validation boundaries.",
  "created_at": "2026-09-02T19:09:16.629850Z"
}
